{
  "manifest_version": "v1",
  "graph_sha256": "c8f9be44d05f3195c00ed20fa34470e03dcd07fe35b18ea1ca01a156019d84dc",
  "runtime_sha256": "a451a25424ee154eb8d6d36be1f6cce37f9874422251947972a4e073eb661ca5",
  "issued_at": "2026-08-09T13:54:13.450248Z",
  "expires_at": "2026-08-09T14:54:13.450248Z",
  "revoked": false,
  "runtime_profile": "pilot-local",
  "runtime_identity": {
    "platform": "darwin",
    "python": "3.14",
    "executable": "python3.14"
  },
  "tool_snapshot": {},
  "approval_binding": {
    "run_id": "pilot-2-avalanche",
    "graph_sha256": "c8f9be44d05f3195c00ed20fa34470e03dcd07fe35b18ea1ca01a156019d84dc",
    "artifact_digest": "sha256:pilot-2-final",
    "action": "publish",
    "target": "human-gate-publish",
    "approver": "synthetic-pilot-harness",
    "decision": "approved",
    "approved_at": "2026-08-09T13:54:13.450248Z",
    "expires_at": "2026-08-09T14:54:13.450248Z"
  }
}
